ID	E	EFINP	NOT	NFP	IAD	text
1	1	0	0	0	0	Dum hund !
2	1	0	0	0	0	Dårlig hund !
3	1	0	0	0	0	Dette er ikke moro .
4	1	0	0	0	0	Det er tarmvriende smertefullt på en måte som skulle vært forbi på det seine åttitallet som vi kalte nittitall og som førte til filmer som « Beethoven » .
5	1	0	0	0	0	Marmaduke er en grand danois , og den er laget i delvis animasjon , sånn at den etter hvert ser mer fjollete ut enn hest i hatt , enn ku i kyse , enn katt i kappe .
6	1	0	1	0	1	Poenget med filmen er at Marmaduke må flytte med familien fra Kansas til California , og der involveres han i et slags hundeverdenens high school-helvete med jocker og cluelesser og geeker .
7	1	0	0	0	0	Marmaduke vanker med bastardene og mobbes av de rasereine , og det eneste som skjer er en fjollete , uferdig overføring fra ungdomsfilmer til hvalpe-fetisjismen , og det er stygt .
8	1	0	0	0	0	Det hjelper ikke stort at matpappa må gjøre det godt i hundematbransjen for at sjefen skal bli glad , og at hundene skal surfe og at Marmaduke får kjøterqueen som kjæreste og svikter henne til fordel for en collie-kaksinne .
